{
  "schema_version": "1.0",
  "garment": "aldrich_skirt",
  "assembly": "assert/assemblies/aldrich_skirt.assembly.json",
  "notes": "Seam suffix _L / _R = the wearer's left (+x) / right (-x). The alignment puts the pattern's own blocks ('A - Skirt Front', 'A - Skirt Back') on -x and their mirrors (Skirt_Front_R, Skirt_Back_R) on +x. The job (assert/jobs/aldrich_skirt.json) has only the two skirt blocks: no waistband, facing or zip piece, so the waist edge is left free. The darts are not cut into the outline: each is sewn along its legs from the waist (dart-cap points on the outline) to its apex (an interior named point).",
  "defaults": {"samples_per_cm": 2, "max_length_diff_pct": 3, "max_gap_m": 0.3},
  "seams": [
    {"id": "side_R", "label": "right side seam: front waist A16 -> hip A7 -> hem A8c to back waist A10 -> A7 -> hem A8a", "kind": "plain",
     "a": {"piece": "A - Skirt Front", "chain": ["A16", "A16e", "A16b", "A7", "A8c"]},
     "b": {"piece": "A - Skirt Back", "chain": ["A10", "A10b", "A7", "A8a"]}},
    {"id": "side_L", "label": "left side seam: front waist A16 -> hip A7 -> hem A8c to back waist A10 -> A7 -> hem A8a", "kind": "plain",
     "a": {"piece": "Skirt_Front_R", "chain": ["A16", "A16e", "A16b", "A7", "A8c"]},
     "b": {"piece": "Skirt_Back_R", "chain": ["A10", "A10b", "A7", "A8a"]}},
    {"id": "centre_front", "label": "centre front fold A2 -> A4 (front cut on the fold)", "kind": "join_mirror",
     "a": {"piece": "A - Skirt Front", "chain": ["A2", "A6", "A6a", "A4"]},
     "b": {"piece": "Skirt_Front_R", "chain": ["A2", "A6", "A6a", "A4"]}},
    {"id": "centre_back", "label": "centre back A1 -> A3 (back cut on the fold; no zip piece in the job)", "kind": "join_mirror",
     "a": {"piece": "A - Skirt Back", "chain": ["A1", "A5", "A5a", "A3"]},
     "b": {"piece": "Skirt_Back_R", "chain": ["A1", "A5", "A5a", "A3"]}},
    {"id": "front_dart_R", "label": "right front dart: leg A17a -> apex A18 to leg A17b -> A18", "kind": "dart",
     "a": {"piece": "A - Skirt Front", "line": ["A17a", "A18"]}, "b": {"piece": "A - Skirt Front", "line": ["A17b", "A18"]}},
    {"id": "front_dart_L", "label": "left front dart: leg A17a -> apex A18 to leg A17b -> A18", "kind": "dart",
     "a": {"piece": "Skirt_Front_R", "line": ["A17a", "A18"]}, "b": {"piece": "Skirt_Front_R", "line": ["A17b", "A18"]}},
    {"id": "back_dart_cb_R", "label": "right back dart nearer the CB: leg A13a -> apex A13 to leg A13b -> A13", "kind": "dart",
     "a": {"piece": "A - Skirt Back", "line": ["A13a", "A13"]}, "b": {"piece": "A - Skirt Back", "line": ["A13b", "A13"]}},
    {"id": "back_dart_cb_L", "label": "left back dart nearer the CB: leg A13a -> apex A13 to leg A13b -> A13", "kind": "dart",
     "a": {"piece": "Skirt_Back_R", "line": ["A13a", "A13"]}, "b": {"piece": "Skirt_Back_R", "line": ["A13b", "A13"]}},
    {"id": "back_dart_side_R", "label": "right back dart nearer the side: leg A14a -> apex A14 to leg A14b -> A14", "kind": "dart",
     "a": {"piece": "A - Skirt Back", "line": ["A14a", "A14"]}, "b": {"piece": "A - Skirt Back", "line": ["A14b", "A14"]}},
    {"id": "back_dart_side_L", "label": "left back dart nearer the side: leg A14a -> apex A14 to leg A14b -> A14", "kind": "dart",
     "a": {"piece": "Skirt_Back_R", "line": ["A14a", "A14"]}, "b": {"piece": "Skirt_Back_R", "line": ["A14b", "A14"]}}
  ],
  "ignore_edges": [
    {"piece": "A - Skirt Front", "chain": ["A2", "A17b", "A17e", "A17a", "A17d", "A16"], "reason": "waist: no waistband in the job (finished edge); A17b-A17e-A17a is the front dart cap"},
    {"piece": "Skirt_Front_R", "chain": ["A2", "A17b", "A17e", "A17a", "A17d", "A16"], "reason": "waist: no waistband in the job (finished edge); A17b-A17e-A17a is the front dart cap"},
    {"piece": "A - Skirt Back", "chain": ["A1", "A13a", "A11b", "A13b", "A14a", "A12a", "A14b", "A10"], "reason": "waist: no waistband in the job (finished edge); A13a-A11b-A13b and A14a-A12a-A14b are the dart caps"},
    {"piece": "Skirt_Back_R", "chain": ["A1", "A13a", "A11b", "A13b", "A14a", "A12a", "A14b", "A10"], "reason": "waist: no waistband in the job (finished edge); A13a-A11b-A13b and A14a-A12a-A14b are the dart caps"},
    {"piece": "A - Skirt Front", "chain": ["A8c", "A4"], "reason": "hem (finished)"},
    {"piece": "Skirt_Front_R", "chain": ["A8c", "A4"], "reason": "hem (finished)"},
    {"piece": "A - Skirt Back", "chain": ["A8a", "A3"], "reason": "hem (finished)"},
    {"piece": "Skirt_Back_R", "chain": ["A8a", "A3"], "reason": "hem (finished)"}
  ],
  "expect": {"required_seams": ["side_R", "side_L", "centre_front", "centre_back", "front_dart_R", "front_dart_L", "back_dart_cb_R", "back_dart_cb_L", "back_dart_side_R", "back_dart_side_L"]}
}
